{
  "version": 1,
  "title": "BOS-392 accounts list adopts [space] toggle, matching the cron list",
  "fixture": { "preset": "demo" },
  "scenes": [
    {
      "id": "scene-01",
      "title": "accounts list action bar shows [space] toggle",
      "steps": [
        { "key": "s", "caption": "Open the Settings hub" },
        {
          "waitFor": "Settings",
          "timeoutMs": 10000,
          "caption": "Settings screen visible"
        },
        { "key": "a", "caption": "Press [a] to open the Accounts list" },
        {
          "waitFor": {
            "anyOf": ["LABEL PROVIDER", { "text": "Accounts", "match": "normalized" }],
            "label": "Accounts list loaded"
          },
          "timeoutMs": 10000,
          "caption": "Accounts table settled"
        },
        {
          "expect": [
            {
              "text": "[space] toggle",
              "match": "normalized",
              "label": "accounts action bar advertises the unified [space] toggle (BOS-392, was [x] disable/enable)"
            },
            {
              "text": "[d] remove",
              "match": "normalized",
              "label": "accounts action bar still advertises [d] remove"
            }
          ],
          "caption": "Accounts action bar now reads [space] toggle · [d] remove — the [x] disable/enable label is gone"
        }
      ]
    },
    {
      "id": "scene-02",
      "title": "cron list still shows [space] toggle (regression guard)",
      "steps": [
        { "key": "esc", "caption": "Press [esc] to return to Settings" },
        {
          "waitFor": "Settings",
          "timeoutMs": 10000,
          "caption": "Back on the Settings screen"
        },
        { "key": "c", "caption": "Press [c] to open the Scheduled Jobs (cron) list" },
        {
          "waitFor": {
            "anyOf": ["CRON NAME REPO", { "text": "Scheduled", "match": "normalized" }],
            "label": "cron list loaded"
          },
          "timeoutMs": 10000,
          "caption": "Cron list settled"
        },
        {
          "expect": [
            {
              "text": "[space] toggle",
              "match": "normalized",
              "label": "cron action bar shows the same [space] toggle the accounts list now mirrors"
            },
            {
              "text": "[r]un now",
              "match": "normalized",
              "label": "cron action bar still advertises [r]un now"
            }
          ],
          "caption": "Cron action bar reads [space] toggle · [r]un now — both list views now agree"
        }
      ]
    }
  ]
}
